,Label,Example Picture,Description,Prevention,Treatment
36,Tomato__Tomato_mosaic_virus,https://storage.googleapis.com/kagglesdsdata/datasets/277323/658267/color/Tomato___Tomato_mosaic_virus/0ce34f26-3bd6-420e-ba31-0373b465f267___PSU_CG%202099.JPG?X-Goog-Algorithm=GOOG4-RSA-SHA256&X-Goog-Credential=databundle-worker-v2%40kaggle-161607.iam.gserviceaccount.com%2F20240528%2Fauto%2Fstorage%2Fgoog4_request&X-Goog-Date=20240528T225123Z&X-Goog-Expires=345600&X-Goog-SignedHeaders=host&X-Goog-Signature=6878db6fcbd432dcecce713bb2a0a123ebc4346b3a1e76bc50c16f6b9bc75064d7582c7ecba14c6fbf0617b229da71aa992c300763d92b867cfa7027ed0bbf355e4af7c2addda74393951f98a335f8661106c023202390786c88a2db3cf4cbf27744b984c4e1068842d0d8b4ffd217d8c91b492b71132506dca5944d11096d922978e72d60bed026d0174081d4cd3cea8af42fd60d1f274fc642c86698543417edc7d8ad1f628b7ecc2176672bdba1e9fbe4139faae0f5f251de0d8d5a4ef95ce311243ddf16f99022aa46bebb910ab2c731f8468f6740bb304094bb19ce522b9a101179b359c4c61a0c50382a7bc68a628f93b9d6c0ee0987250b58ca83bbb8,"Initial spots: Small, dark brown to black, irregular-shaped spots (less than 1mm) with a yellow margin appear on the older leaves, typically starting at the bottom of the plant. Enlargement: As the disease progresses, some of these spots enlarge up to 10mm in diameter, developing characteristic concentric rings, resembling a target, hence the name ""target spot. ""Concentric rings: These rings are typically brown or reddish-brown with a lighter-colored center. Spread: The disease spreads upwards to younger leaves as it progresses. Stem lesions: Elongated, dark brown lesions may also appear on the stems. Fruit infection: In severe cases, small, light brown spots with dark margins may appear on the fruit.","Resistant varieties: Choosing tomato cultivars known for resistance to target spot is the most effective preventative measure. Cultural practices:Rotate crops with non-host plants like corn, beans, or small grains to break the disease cycle.Avoid overhead watering, as moisture on leaves promotes fungal growth. Water deeply at the base of the plants instead.Space plants adequately to allow for good air circulation and prevent overcrowding.Remove and destroy infected plant debris after harvest to reduce overwintering fungal spores. Fungicides: Apply preventative fungicides containing copper or chlorothalonil before symptoms appear, especially during periods of warm, humid weather.","Fungicides: Once symptoms appear, fungicides containing copper or chlorothalonil can help slow the spread of the disease.Severe cases:In severe cases, heavily infected leaves may need to be removed and destroyed to prevent further spread within the garden.Hygiene:Maintain good hygiene by removing infected leaves and debris, and avoid working with wet plants to minimize the risk of further spreading the fungus."
37,Tomato__healthy,https://storage.googleapis.com/kagglesdsdata/datasets/277323/658267/color/Tomato___healthy/0576ef4b-c843-4dfb-b148-c917f7d605b7___GH_HL%20Leaf%20299.JPG?X-Goog-Algorithm=GOOG4-RSA-SHA256&X-Goog-Credential=databundle-worker-v2%40kaggle-161607.iam.gserviceaccount.com%2F20240527%2Fauto%2Fstorage%2Fgoog4_request&X-Goog-Date=20240527T010915Z&X-Goog-Expires=345600&X-Goog-SignedHeaders=host&X-Goog-Signature=225371c50d7882e56f1831e7028c6122ca3279d02b833f05d238ab6b8ec7034bcba5c817f7d39694ad02a24f32a02eeaadaf9aab1d8519c6231f20f9225872d5212f2ab908eedc64e405c676af07c0084f6fe1a4ea5edf0e3275fc0bae76affa38a1dcc78bec0e97b5b42e3978b76713121b0de73422d2c79853c908036c0069ec6236ba73066e89bf0d5e3cffdba62f90c769e6ca7bde2992e17bf10da0fe204f616a0960e3faf27973011ead20c987ce144382fe5f9009e9665c802642f69b69962b98a313d8b267fe6d9c91a665984e87de5143c9eb5ec81cf839b8bc6bb34786209e6183e2a33ac52422490fd5b95b26287668c638b5b39e6b4b62fc8200,"Tomato Yellow Leaf Curl Virus (TYLCV) is a highly contagious viral disease that poses a significant threat to tomato crops. Transmitted primarily by whiteflies, TYLCV causes severe damage to the plant's leaves, leading to stunted growth and drastically reduced fruit yield.","Choose resistant varieties: Selecting tomato cultivars known for resistance to TYLCV is the most effective preventative measure.Control whiteflies: Implement measures to control whitefly populations, the primary transmitters of TYLCV. This can involve using insect traps, applying insecticidal soaps, or introducing natural enemies like ladybugs or lacewings.Maintain good hygiene: Regularly remove weeds and debris from your garden, as they can harbor whiteflies and contribute to the spread of the virus. Additionally, remove and destroy any infected tomato plants immediately to prevent further transmission within your crop.","While there is no cure for infected plants, here are steps to minimize the spread and potentially salvage unaffected portions of the crop:Immediate removal: Upon identifying TYLCV symptoms, promptly remove and destroy all infected plants. This helps prevent further transmission within the field and protects neighboring healthy plants.Control whiteflies: Implement stricter whitefly control measures, as these insects are the primary vectors of TYLCV. This might involve using stronger insecticides or introducing more intensive biological control methods like releasing large numbers of predatory insects.Isolate infected areas: If possible, physically isolate infected areas within the field to prevent the spread of the virus to unaffected plants. This may involve creating physical barriers or maintaining a significant distance between healthy and infected crops."
38,,,"Mottling: The most common symptom is a mosaic pattern on the leaves, characterized by alternating patches of light and dark green, sometimes accompanied by yellowing.Deformation: Leaves may become distorted, appearing wrinkled, cupped, or puckered.Stunted growth: In severe cases, infected plants may exhibit stunted growth, with smaller leaves and shorter internodes (spaces between leaves).Necrosis: In some situations, particularly under warm temperatures, dead brown spots or necrotic areas may develop on the leaves.","
Resistant varieties: Choosing tomato cultivars known for resistance to ToMV is the most effective preventative measure.Control insect vectors: Implement measures to control aphids, whiteflies, and other sap-sucking insects that can transmit the virus. This can involve using insecticidal soaps, introducing beneficial insects like ladybugs, or using insect traps.Hygiene: Maintain good hygiene practices in the garden. This includes disinfecting tools and equipment regularly, washing hands thoroughly after handling infected plants, and removing and destroying any plant debris that might harbor the virus.Seed treatment: Consider treating seeds with a 10% bleach solution or hot water treatment (specific temperatures and durations vary) to eliminate potential seed-borne ToMV.","While there is no cure for ToMV itself, here's what can be done to minimize its spread:Immediate removal: Upon identifying ToMV symptoms, promptly remove and destroy all infected plants. This helps prevent further transmission within the field and protects neighboring healthy plants.Isolate infected areas: If possible, physically isolate infected areas within the field to prevent the spread of the virus to unaffected plants. This may involve creating physical barriers or maintaining a significant distance between healthy and infected crops"
39,,,"Healthy tomato leaves are a vibrant, deep green with a smooth, matte texture. They are evenly shaped and sized, firm and flexible, with distinct veins and smooth, intact margins. This uniform appearance indicates a healthy plant.","Proper watering: Avoid overwatering or underwatering, providing consistent moisture to the soil.Sunlight: Ensure your tomato plants receive adequate sunlight, typically around 6-8 hours per day.Fertilization: Regularly fertilize with a balanced fertilizer suitable for vegetables, following the recommended application rates.Spacing: Space plants adequately to allow for good air circulation and prevent overcrowding, which can create favorable conditions for disease development.Pest and disease monitoring: Regularly monitor your tomato plants for signs of pests or diseases. Take appropriate action, such as using insecticidal soaps or introducing beneficial insects for pest control, or applying fungicides for disease management, if necessary.",
